{
  "audio_context_present": true,
  "cinematic_visuals": {
    "dialogue_contents_exported": false,
    "excluded_command_counts": {
      "audio_commands_redacted": 1,
      "dialogue_commands_redacted": 19,
      "script_commands_redacted": 29,
      "script_continuation_commands_redacted": 14
    },
    "script_bodies_exported": false,
    "visual_command_counts": {
      "animation_on_entity": 2,
      "forced_move_route": 9,
      "map_transfer": 1
    }
  },
  "collision": {
    "derived_directional_grid": {
      "custom_script_overrides_executed": false,
      "directions": [
        "down",
        "left",
        "right",
        "up"
      ],
      "file": "zones/collision/map_008_directional.json",
      "method": "RGSS1_STANDARD_PRIORITY_AND_PASSAGE_FLAGS",
      "sha256": "0a447715b48b1d74052f9ca7e2e20644a6ca7bfb04181d91e26a3d9c5ae8272b"
    },
    "dynamic_entities": {
      "file": "zones/entities/map_008_entities.json",
      "placements_complete": true,
      "sha256": "d11997de0c74b2953611c18813b57ca9f1b0e6b45e51bf2740b6386568174b5d"
    },
    "height": 23,
    "layer_count": 3,
    "map_id": 8,
    "schema_version": "1.0.0",
    "source_complete": true,
    "source_layers": {
      "encoding": "row-major-z-layers-json-u16",
      "file": "zones/geometry/map_008_layers.json",
      "sha256": "f3f1a73aea88189f4c55009031b082e36e737a402c71a758ddbd6b0c38c6e74d",
      "value_count": 1932
    },
    "tile_size_px": 32,
    "tileset_tables": {
      "file": "tilesets/collision/tileset_003.json",
      "passages_complete": true,
      "priorities_complete": true,
      "sha256": "4d51ea89ae50c81d1efabb98f5990710a475ed6bc6cf73374486d84c4fed4971",
      "terrain_tags_complete": true
    },
    "width": 28
  },
  "entities": {
    "cast_placeholder_count": 3,
    "environmental_tile_entity_count": 0,
    "file": "zones/entities/map_008_entities.json",
    "logic_marker_count": 1,
    "page_placement_count": 4,
    "placement_count": 4,
    "sha256": "d11997de0c74b2953611c18813b57ca9f1b0e6b45e51bf2740b6386568174b5d",
    "source_identities_redacted": true
  },
  "game_id": "relict",
  "geometry": {
    "height_px": 736,
    "height_tiles": 23,
    "layer_count": 3,
    "tile_size_px": 32,
    "width_px": 896,
    "width_tiles": 28
  },
  "name": "Alabaster Icelands (Ending)",
  "parent_map_id": 15,
  "pmdo": {
    "adaptation_needs": [
      "Map RMXP passage/priority/terrain semantics to RogueEssence terrain and collision.",
      "Replace every CAST_PLACEHOLDER with an approved New Era actor.",
      "Validate visual commands, movement routes, overlays and timings scene by scene."
    ],
    "conversion_started": false,
    "differences": [
      "RMXP uses three 32px tile layers and per-tile passage flags.",
      "Dynamic event collision and page conditions must become explicit PMDO entities.",
      "Source cast graphics are redacted and require New Era replacements."
    ]
  },
  "problems": [],
  "schema_version": "1.0.0",
  "source": {
    "commit": "6963878956ec4c53833c03f26aa6a9aafd17800f",
    "extraction_method": "bounded pure-Python Ruby Marshal 4.8 reader; no source code execution",
    "license_status": "UNKNOWN",
    "repository": "https://github.com/meromoonmeri/BIBLIOTHEQUE",
    "sha256": "d3feabba725a6eeddfaa222330c6e5ab314b86258a3a2a40d50433d939197281",
    "size_bytes": 11465,
    "source_format": "RPG Maker XP Ruby Marshal 4.8 RPG::Map",
    "source_path": "Relict/Relict V1.2/Relict/Data/Map008.rxdata"
  },
  "source_documentation": {
    "animations_complete": true,
    "collision_complete": true,
    "contact_sheet_sha256": "5420d1827e576d7f53eea015e5a3d01ba65902d4ee461b0125ea552e82bbf0cb",
    "entity_placements_complete": true,
    "geometry_complete": true,
    "manual_contact_sheet_review": "PASS_2026-08-13",
    "timeline_complete": true,
    "visual_dependencies_complete": true
  },
  "source_map_id": 8,
  "source_order": 15,
  "status": "SOURCE_DOCUMENTED",
  "tile_layers": {
    "all_source_values_preserved": true,
    "file": "zones/geometry/map_008_layers.json",
    "sha256": "f3f1a73aea88189f4c55009031b082e36e737a402c71a758ddbd6b0c38c6e74d"
  },
  "tileset": {
    "autotile_slots": [
      {
        "name": "grassDungeon2",
        "slot": 0
      },
      {
        "name": "waterDungeon2",
        "slot": 1
      },
      {
        "name": "pathDungeon2",
        "slot": 2
      },
      {
        "name": "snow",
        "slot": 3
      },
      {
        "name": "",
        "slot": 4
      },
      {
        "name": "",
        "slot": 5
      },
      {
        "name": "",
        "slot": 6
      }
    ],
    "fog": "",
    "name": "dungeon2",
    "panorama": "",
    "source_id": 3
  },
  "variants": [],
  "visual_dependencies": [
    {
      "ambiguous_match_count": 1,
      "dimensions": {
        "height_px": 128,
        "width_px": 96
      },
      "kind": "AUTOTILE",
      "problems": [],
      "resolved": true,
      "sha256": "d8a9de2a64bcefcd19bbbe6418b9f57c7a08199b129858c1e22313b3bf34a6dc",
      "size_bytes": 2100,
      "source_commit": "6963878956ec4c53833c03f26aa6a9aafd17800f",
      "source_name": "grassDungeon2",
      "source_path": "Graphics/Autotiles/grassDungeon2.png"
    },
    {
      "ambiguous_match_count": 1,
      "dimensions": {
        "height_px": 128,
        "width_px": 96
      },
      "kind": "AUTOTILE",
      "problems": [],
      "resolved": true,
      "sha256": "14283575a4e3265b601f0d405531ae7fa5c7c2ebe6e0c7f7003f5d15ee833ad4",
      "size_bytes": 1802,
      "source_commit": "6963878956ec4c53833c03f26aa6a9aafd17800f",
      "source_name": "pathDungeon2",
      "source_path": "Graphics/Autotiles/pathDungeon2.png"
    },
    {
      "ambiguous_match_count": 1,
      "dimensions": {
        "height_px": 128,
        "width_px": 96
      },
      "kind": "AUTOTILE",
      "problems": [],
      "resolved": true,
      "sha256": "572b0f9163ef0db6651778c409e93c7c5ac57ee357ecfcbb04a488dd6bf8a7f4",
      "size_bytes": 1321,
      "source_commit": "6963878956ec4c53833c03f26aa6a9aafd17800f",
      "source_name": "snow",
      "source_path": "Graphics/Autotiles/snow.png"
    },
    {
      "ambiguous_match_count": 1,
      "dimensions": {
        "height_px": 128,
        "width_px": 384
      },
      "kind": "AUTOTILE",
      "problems": [],
      "resolved": true,
      "sha256": "dd3f3781334756ff4d91d2671fe292ac48b356c4ac20660bcfea2adce1071184",
      "size_bytes": 5126,
      "source_commit": "6963878956ec4c53833c03f26aa6a9aafd17800f",
      "source_name": "waterDungeon2",
      "source_path": "Graphics/Autotiles/waterDungeon2.png"
    },
    {
      "ambiguous_match_count": 2,
      "dimensions": {
        "height_px": 928,
        "width_px": 256
      },
      "kind": "TILESET",
      "problems": [
        "AMBIGUOUS_CASE_INSENSITIVE_MATCH"
      ],
      "resolved": true,
      "sha256": "83cd1fa0a1d046927b42c5f3c70cc95564478b553c206b98e58e43b615fa3dfa",
      "size_bytes": 20559,
      "source_commit": "6963878956ec4c53833c03f26aa6a9aafd17800f",
      "source_name": "dungeon2",
      "source_path": "Graphics/Tilesets/dungeon2.png"
    }
  ],
  "zone_id": "relict_map_008",
  "zone_type": "CINEMATIC",
  "zone_type_inferred": true
}
